{
  "run_id": "run_0001",
  "project_id": "example_project",
  "created_at": "2026-05-27T00:00:00Z",
  "hypothesis": "Baseline gradient boosting model with fold-safe preprocessing.",
  "change_summary": "Added baseline model pipeline.",
  "command": "uv --cache-dir .uv-cache run train-baseline",
  "cwd": "projects/example_project",
  "code_ref": "git:abcdef1",
  "metric": {
    "name": "roc_auc",
    "value": 0.8123,
    "direction": "maximize"
  },
  "baseline_run_id": null,
  "metric_delta": null,
  "status": "advanced",
  "keep_reason": "First valid validation baseline.",
  "artifacts": {
    "metrics": "projects/example_project/outputs/run_0001_metrics.json"
  },
  "risk_flags": [],
  "next_hint": "Try one bounded feature family or HPO change."
}
